{
  "$schema": "./rules-index.schema.json",
  "schemaVersion": "1.0.0",
  "source": "../canvas-interactions.md",
  "sourceSha256": "fd34922205491c5480067e0c1d23e798ce87132052b87dd3853b90ea82493e4f",
  "implementationBaseline": "ad244effde34662fbeedd83813aa3a0dbe7fd82a",
  "authority": "markdown",
  "rules": [
    {
      "id": "CI-MODE-001",
      "title": "基本ツールと戻り先",
      "anchor": "ci-mode-001",
      "status": "v1",
      "acceptanceId": "AT-001",
      "contract": {
        "区分": "v1",
        "状態": "idle / select または hand",
        "入力": "ツールボタン、背景フォーカスでV/H",
        "主体・工程": "全参加者。閲覧可能な作業キャンバス",
        "対象・前提": "本文編集・モーダル・ジェスチャーの所有中でない",
        "結果": "初回はselect。Hでhand、Vでselect。選択集合とカメラは保つ。状態は本人のタブだけに適用。工程変更で基本ツールを勝手に切り替えない。再読込はselectで始める。",
        "取消": "EscapeはCI-IN-003の順序に従う。handのidleではselectへ戻る。",
        "失敗": "不明なキー/IME中は切替しない。ツール切替でサーバー更新しない。",
        "同時操作": "進行変更は一時状態だけを終える。新ツールを押した時に保留中移動を暗黙commitしない。",
        "検証": "AT-001: handへ切替→1-2から1-3へ進行してもhand。再読込はselect。"
      },
      "sha256": "dc5f01aa3e94a8c2b135433635244188e6b7c587ca09370c5f71f23643640bb2"
    },
    {
      "id": "CI-IN-001",
      "title": "入力の所有者を一つにする",
      "anchor": "ci-in-001",
      "status": "v1",
      "acceptanceId": "AT-002",
      "contract": {
        "区分": "v1",
        "状態": "すべて",
        "入力": "pointer/key/wheel",
        "主体・工程": "全参加者、すべての表示工程",
        "対象・前提": "イベントの対象と既存ジェスチャー所有者を判定",
        "結果": "MUST: ①モーダル/入力/IME/ネイティブcontrol ②進行で失効した状態の取消 ③取得済みpointerの所有者 ④明示的な一時パン ⑤hand ⑥select時の投票印/採用待ち ⑦付箋/文脈操作 ⑧空白の選択。1入力を複数の動作へ送らない。実際に処理する時だけpreventDefaultする。",
        "取消": "所有者を解放した同一pointerupを別のclick/採用へ再配送しない。",
        "失敗": "UI重なりや無効対象は下の付箋へclick-throughしない。",
        "同時操作": "別pointerは既存ドラッグを奪わない。gesture所有中のV/H・tool切替は受け付けず、予約もしない。",
        "検証": "AT-002: Space+付箋dragでパンのみ。採用待ちのdrag終了で採用しない。"
      },
      "sha256": "de9401dc3a7caa9af6ce5ca49b245fe72ebf6e0df7c484960447beaa9ed4ecc3"
    },
    {
      "id": "CI-IN-002",
      "title": "押下・クリック・ドラッグを分離する",
      "anchor": "ci-in-002",
      "status": "v1",
      "acceptanceId": "AT-003",
      "contract": {
        "区分": "v1",
        "状態": "idle→pressed→dragging",
        "入力": "主ボタンpointerdown/move/up",
        "主体・工程": "対象能力が許可された参加者",
        "対象・前提": "最上面のヒット対象、同じpointerId",
        "結果": "押下時に起点/対象/修飾キーを固定。閾値未満はclick、閾値以上はdrag。dragが始まったらclick/edit/vote/adoptを抑制。ヒット判定は実寸の付箋境界で、影・操作overlayを含めない。",
        "取消": "pointercancel/lost capture/blurは共通取消。",
        "失敗": "権限のないdragはmoveを送らず、drag相当の動きをclickへ落とさない。",
        "同時操作": "pointerdown後の新規付箋やz順更新で対象をすり替えない。",
        "検証": "AT-003: 25%/100%/200%で同じ画面移動量が同じdrag判定。"
      },
      "sha256": "7dfed16da27aa9f9285e6e1cbb5ed011a6d84dbfdb2161b3aaf7d6bc892a3ba9"
    },
    {
      "id": "CI-IN-003",
      "title": "Escapeの一段取消",
      "anchor": "ci-in-003",
      "status": "v1",
      "acceptanceId": "AT-004",
      "contract": {
        "区分": "v1",
        "状態": "内側の一時状態から外側へ",
        "入力": "Escape",
        "主体・工程": "全参加者",
        "対象・前提": "IME変換確定/取消はIMEを優先",
        "結果": "MUST: IME→dialog/menu→本文編集終了→active drag/marquee取消→投票印/採用待ち解除→選択解除→handをselectへ、のうち最初に該当する1段だけ実行。説明ガイド等独立UIがfocusを持つ時はそのUIの契約を優先。",
        "取消": "編集終了は保存済み本文を元に戻すUndoではない。drag取消後も選択は保つ。",
        "失敗": "無関係な入力値、票、採用、公開状態を一括リセットしない。",
        "同時操作": "工程変更により既に失効した一時状態は復活させない。",
        "検証": "AT-004: 編集中のEscape1回で編集だけ終了、2回目で選択解除。"
      },
      "sha256": "f80af99383d778071c7fa1a009ab385b5a2838c21ddf16a01c3adefa92c8f438"
    },
    {
      "id": "CI-SEL-001",
      "title": "単一選択と読み取り",
      "anchor": "ci-sel-001",
      "status": "v1",
      "acceptanceId": "AT-005",
      "contract": {
        "区分": "v1",
        "状態": "select / idle",
        "入力": "付箋click、Tab+Enterによる対象化",
        "主体・工程": "inspect可能な参加者、全工程",
        "対象・前提": "本人に見える付箋1枚。privateとsharedの選択は混在させない",
        "結果": "非選択の付箋clickで単一選択へ置換。A選択中にTabでBへfocusが移っても集合は変えないが、BでEnterを押すとBを単一選択へ置換する。この1回では編集しない。文字/Deleteはfocusと単一選択が同じ時だけ発火し、違う時はBを選択するだけで文字追加/削除しない。見た目と読み上げで選択を示す。権限のない本文/移動でも読むための選択は可。空白clickで解除。カメラ操作/タイマー/Tab移動だけでは解除しない。",
        "取消": "Escapeで解除。削除/非共有化等で見えなくなったIDは取り除く。",
        "失敗": "選択しただけで編集・採用・投票・共有を行わない。直接の単一clickによる既存前面化はCI-NOTE-003として区別する。",
        "同時操作": "他者の選択を同期しない。他者移動しても同じ可視IDは選択を保つ。",
        "検証": "AT-005: 候補外付箋を一般参加者が選ぶと読みやすくなるが復帰権限は増えない。"
      },
      "sha256": "ac72db2401d7f74a244037953c1453ff2d5f645243720cdb4d3801b63e20234a"
    },
    {
      "id": "CI-SEL-002",
      "title": "複数選択と範囲選択",
      "anchor": "ci-sel-002",
      "status": "v1",
      "acceptanceId": "AT-006",
      "contract": {
        "区分": "v1",
        "状態": "select / idle、工程コマンド未armed",
        "入力": "Shift+click、空白主ボタンdrag、Shift+空白drag",
        "主体・工程": "inspect可能な参加者",
        "対象・前提": "現在フェーズの可視shared付箋。privateパネル/過去フェーズ/操作overlayは除く",
        "結果": "空白dragで矩形と接触した付箋を選ぶ（境界接触を含む、方向に依存しない）。通常矩形は集合置換、Shift矩形は押下時集合への和集合。Shift+clickは1枚をtoggle。候補外も選択可。隠れた付箋は描画されていて矩形と交わるなら対象、配信されないものは対象外。",
        "取消": "Escape/取消で押下前集合へ戻る。空矩形の通常確定は空集合、Shiftなら元集合。",
        "失敗": "権限が混じっても勝手に移動可の一部だけを動かさない。範囲内のボタンを発火しない。",
        "同時操作": "候補IDをpointerdown時に固定し、up時に不可視となったIDを除く。交差判定はup時の現在描画境界で行い、ハイライトと一致させる。他者移動/本文伸長を現在境界へ反映し、途中追加は次回選択対象。",
        "検証": "AT-006: A/Bに接触する矩形でA/B。ShiftでC追加、Shift+BでBだけ解除。"
      },
      "sha256": "bd684461a78aadb05089052b150d405da679b9407d991dedccaca5f983883abb"
    },
    {
      "id": "CI-SEL-003",
      "title": "複数選択の操作範囲",
      "anchor": "ci-sel-003",
      "status": "v1",
      "acceptanceId": "AT-007",
      "contract": {
        "区分": "v1",
        "状態": "選択数2以上",
        "入力": "選択付箋drag、単一付箋click",
        "主体・工程": "moveSharedの能力に従う",
        "対象・前提": "同一フェーズ/sharedのみ",
        "結果": "v1の一括操作は移動のみ。選択済み付箋のクリックだけはその1枚へ縮小、dragなら押下時集合を維持して相対移動。未選択Cをdragした場合はC単一へ置換してCを動かす。Shiftによるtoggleはclick確定時だけ実行し、Shift+dragではtoggleせず、選択済みなら集合・未選択ならその1枚を移動。単一本文編集・色/文字サイズ・削除・共有・非共有化・候補整理・採用・投票の一括入口は出さない。",
        "取消": "空白click/Escapeで全解除。Shiftで残り1枚なら単一操作へ戻る。",
        "失敗": "複数の中の先頭/最後へ単一操作を暗黙適用しない。",
        "同時操作": "削除/不可視化で集合が1枚になった場合のみ通常単一状態へ移る。",
        "検証": "AT-007: 3枚選択中Delete/文字入力/候補外ボタンは一括変更せず、dragだけ3枚を動かす。"
      },
      "sha256": "039212cdea9ef24c12bcf687f4989cab9a9030df6b8b6bf1745e4d9fc4ffd37c"
    },
    {
      "id": "CI-PAN-001",
      "title": "画面移動",
      "anchor": "ci-pan-001",
      "status": "v1",
      "acceptanceId": "AT-008",
      "contract": {
        "区分": "v1",
        "状態": "hand、または一時パン",
        "入力": "handで主drag、Space保持+主drag、中ボタンdrag",
        "主体・工程": "全参加者、閲覧できるキャンバス",
        "対象・前提": "キャンバス面。入力欄・モーダル・マイ付箋パネル・HUDは除く",
        "結果": "押下時カメラ+画面差分だけを更新。付箋上からもパン可。open-hand/grabbingを示す。Spaceは一時上書き、解除後は元基本ツール。選択/投票印/採用待ちは保つ。",
        "取消": "pointerup/Space解除/blurで一時パンを終え、最後に描画したカメラ位置を維持。",
        "失敗": "panは付箋移動や共有ではない。右ボタンは文脈メニューに残す。",
        "同時操作": "付箋drag中に後からSpaceを押してもpanへ乗換えない。",
        "検証": "AT-008: 選択付箋上Space+drag後、付箋座標不変、カメラのみ変更、Space解除でselect。"
      },
      "sha256": "3d67559fefbe7e81768b3a93e26e08c7592dcde0d3a9013d44887fa0c09d76e7"
    },
    {
      "id": "CI-PAN-002",
      "title": "ズーム・スクロール・全体表示",
      "anchor": "ci-pan-002",
      "status": "v1",
      "acceptanceId": "AT-009",
      "contract": {
        "区分": "v1",
        "状態": "idle",
        "入力": "wheel、trackpad、ズーム/100%/全体表示ボタン",
        "主体・工程": "全参加者",
        "対象・前提": "キャンバス上。内側にスクロール対象がある時はその対象を優先",
        "結果": "通常wheel/2指scrollはpan。Shift+縦wheelは水平だけpan。Ctrl/Meta+wheelまたはブラウザが同形式で通知するpinchはポインター中心zoom。ボタンzoomは作業可能領域中央。上下限は既存camera定数。全体表示はHUDを避け現在の可視付箋を含める。2軸マップはmapと付箋双方を含める。",
        "取消": "操作取消は不要。100%はzoomだけ、全体表示は明示操作のみ。",
        "失敗": "window全体のブラウザzoomを奪わない。空ボードの全体表示は既定カメラ。",
        "同時操作": "active drag/marquee中のwheel-camera変更はv1では受け付けず、座標系を固定。他者操作で自動fitしない。",
        "検証": "AT-009: Shift+wheelでy不変。共有/再投票ループや他者追加で本人カメラをリセットしない。"
      },
      "sha256": "20b33fcfeaca43c042f81a6d7be9c89abc14aa3efd9257b55830ca7915d82a15"
    },
    {
      "id": "CI-NOTE-001",
      "title": "付箋の作成・本文編集",
      "anchor": "ci-note-001",
      "status": "inherited",
      "acceptanceId": "AT-010",
      "contract": {
        "区分": "inherited",
        "状態": "selectで本人private作業、またはfocusと単一選択が一致しedit可能",
        "入力": "既存作成入口、選択済みclick、Enter、印字文字",
        "主体・工程": "既存createPrivate/edit能力のみ",
        "対象・前提": "1枚。本文editorがfocusを持つ時は通常の文字編集",
        "結果": "作成はprivate領域のみ。最初clickは選択、次click/Enter/印字文字で本文編集。印字文字は既存本文末尾へ1文字だけ入れる。V/Hも付箋focusなら文字入力でありツール変更しない。2000文字、全文が見える可変高、色/文字サイズの既存要件を維持。",
        "取消": "Escapeで編集終了。IME中Escapeは変換を優先。blurは既存autosaveを継続。",
        "失敗": "保存失敗を成功表示しない。未送信本文を保持して再試行可能にする。",
        "同時操作": "他者編集/工程進行で上書き可能性がある時は最新server状態とローカル未送信を区別し、本文を無言で破棄しない。",
        "検証": "AT-010: 選択付箋にh→末尾h、本文編集欄にSpace→空白。どちらもカメラ不変。"
      },
      "sha256": "71b462d2d5d9f6fbf7962f8d543bb01d5c90163696398cbe4dfce8175490e454"
    },
    {
      "id": "CI-NOTE-002",
      "title": "削除キーと安全な対象",
      "anchor": "ci-note-002",
      "status": "v1",
      "acceptanceId": "AT-011",
      "contract": {
        "区分": "v1",
        "状態": "単一選択とfocusが一致・editor外",
        "入力": "Delete、明示削除操作（Mac前方削除はFn+Delete）",
        "主体・工程": "既存delete能力のみ",
        "対象・前提": "自分のprivate付箋1枚。共有済みの削除権限を新設しない",
        "結果": "Deleteは許可対象のみ削除。Backspaceはeditor外で付箋丸ごと削除に使わない。editor内のDelete/Backspaceは文字編集。削除済み対象へのfocusは近接付箋/作成入口へ戻す。",
        "取消": "取消やUndoの新機能はこの仕様で追加しない。既存確認/復元契約に従う。",
        "失敗": "拒否時は付箋を残し理由を示す。押し続けで隣の付箋を連続削除しない。",
        "同時操作": "進行で権限失効した削除を再送しない。",
        "検証": "AT-011: private付箋を選択しBackspace→残る。Delete→権限があればその1枚のみ。"
      },
      "sha256": "fffff2cf2548b74b3f66d8e17b7d8d17e39aab5b66c475ac0beb6b6083ee6c6d"
    },
    {
      "id": "CI-MOVE-001",
      "title": "単一共有付箋の移動",
      "anchor": "ci-move-001",
      "status": "v1",
      "acceptanceId": "AT-012",
      "contract": {
        "区分": "v1",
        "状態": "select、選択0/1、または採用待ち",
        "入力": "付箋主drag",
        "主体・工程": "moveShared可能な全参加者",
        "対象・前提": "現在のshared付箋。候補外も同じ。別ユーザーlockがない",